{
  "dry_run_id": "PROMO-DRY-RUN-GREEN-RUN-20260521-202417-001",
  "created_at": "2026-05-21T19:40:05.376Z",
  "source_run_id": "GREEN-RUN-20260521-202417",
  "package_id": "DRAFT-CAND-PKG-GREEN-RUN-20260521-202417-001",
  "intake_id": "INTAKE-GREEN-RUN-20260521-202417-001",
  "decision_id": "DECISION-GREEN-RUN-20260521-202417-001",
  "approval_id": "APPROVAL-GREEN-RUN-20260521-202417-001",
  "candidate_hash": "ca4df6dd1c503954",
  "dry_run_status": "private_promotion_dry_run",
  "suggested_public_record_id": {
    "suggested_id": "INC-0014-SUGGESTED",
    "id_status": "suggestion_only",
    "creates_public_record": false
  },
  "suggested_title": "AI Governance Review: Information Commissioner's Office (ICO) AI and Algorithms",
  "suggested_record_type": "candidate",
  "legal_governance_relevance": "high",
  "governance_chain": {
    "candidate_signal": "Ingested signal from Information Commissioner's Office (ICO) AI and Algorithms (ico-ai-and-algorithms) under run GREEN-RUN-20260521-202417.",
    "legal_or_governance_risk": "Risk level is high. Potential AI and governance compliance misalignment.",
    "likely_failure_mode": "Identified failure mode(s): FM-COMPLIANCE-DEFICIT, FM-GOVERNANCE-GAP.",
    "missing_controls": "Identified missing control theme(s): CTL-GUIDANCE-TRACKING, CTL-COMPLIANCE-UPDATE-PROCESS.",
    "required_evidence": "Required evidence question: Have we mapped and reviewed the latest guidance from Information Commissioner's Office (ICO) AI and Algorithms?",
    "vendor_questions": "Required vendor question: Does the vendor track and conform to AI governance guidance issued by Information Commissioner's Office (ICO) AI and Algorithms?",
    "training_lesson": "Ensure regular ingestion and compliance tracking of Information Commissioner's Office (ICO) AI and Algorithms guidelines.",
    "client_checklist_items": "Verify system alignment with Information Commissioner's Office (ICO) AI and Algorithms requirements."
  },
  "proposed_public_summary": "AI Governance Case Candidate: Information Commissioner's Office (ICO) AI and Algorithms. This candidate was surfaced by the Caesar AI monitoring pipeline from a Green-tier regulatory/guidance source. The signal indicates potential compliance gaps in CTL-GUIDANCE-TRACKING and CTL-COMPLIANCE-UPDATE-PROCESS. Human legal and governance review is required before any public promotion or publication. This summary is Caesar-native and metadata-only — no source text has been copied.",
  "proposed_failure_modes": [
    "FM-COMPLIANCE-DEFICIT",
    "FM-GOVERNANCE-GAP"
  ],
  "proposed_control_themes": [
    "CTL-GUIDANCE-TRACKING",
    "CTL-COMPLIANCE-UPDATE-PROCESS"
  ],
  "proposed_evidence_questions": [
    "Have we mapped and reviewed the latest guidance from Information Commissioner's Office (ICO) AI and Algorithms?",
    "Is there a documented compliance gap assessment against Information Commissioner's Office (ICO) AI and Algorithms's guidelines?"
  ],
  "proposed_vendor_questions": [
    "Does the vendor track and conform to AI governance guidance issued by Information Commissioner's Office (ICO) AI and Algorithms?",
    "What evidence does the vendor provide to demonstrate compliance with the latest Information Commissioner's Office (ICO) AI and Algorithms standards?"
  ],
  "legal_review_checklist": {
    "source_classification_checked": true,
    "no_third_party_text_copied": true,
    "public_narrative_lawyer_approved": false,
    "guidance_vs_enforcement_checked": true,
    "evidence_requirements_identified": true,
    "vendor_questions_identified": true,
    "publication_risk_approved": false
  },
  "publication_blockers": [
    "human legal/governance review required",
    "source quotation review required",
    "no public-safe narrative approved",
    "no promotion packet created",
    "no preview generated",
    "no Control Tower public publish approval"
  ],
  "missing_items": [
    "human legal/governance review signature",
    "source text quotation verification",
    "public disclosure suitability check",
    "formal promotion packet generation (T068)",
    "publication preview validation",
    "Control Tower final publish approval"
  ],
  "public_publish_ready": false,
  "real_promotion_packet_created": false,
  "public_preview_created": false,
  "public_record_created": false,
  "public_site_mutated": false,
  "remote_write_attempted": false,
  "raw_text_stored": false,
  "html_stored": false,
  "safety_flags": {
    "no_raw_html": true,
    "no_long_third_party_text": true,
    "no_secrets_exposed": true,
    "no_unauthorized_remote_writes": true,
    "no_public_site_leak": true,
    "no_inc_0014_created": true,
    "no_real_promotion_packet": true,
    "no_public_preview": true
  }
}
